Companies,Keywords,Search,Search Engine,Title,Link,Time Stamp,Media name
Reliance,Merger,Reliance Merger,Bing,Reliance Disney Merger: CCI Clears Deal; Check Mukesh & Nita Ambani’s Role In New Conglomerate,https://www.msn.com/en-in/foodanddrink/recipes/reliance-disney-merger-cci-clears-deal-check-mukesh-nita-ambani-s-role-in-new-conglomerate/ar-AA1pCRiP?ocid=BingNewsVerp,,India.com on MSN
Reliance,Merger,Reliance Merger,Bing,CCI approves Reliance-owned Viacom 18 and Disney’s $8.5 billion merger deal,https://timesofindia.indiatimes.com/technology/tech-news/cci-approves-reliance-owned-viacom-18-and-disneys-8-5-billion-merger-deal/articleshow/112876847.cms,,Indiatimes
Reliance,Merger,Reliance Merger,Bing,Mukesh Ambani's Reliance And Disney Merger Approved: $8.5 Billion Deal Gets CCI Nod,https://www.msn.com/en-in/money/topstories/mukesh-ambani-s-reliance-and-disney-merger-approved-8-5-billion-deal-gets-cci-nod/ar-AA1pAaeT?ocid=BingNewsVerp,,MSN
Reliance,Merger,Reliance Merger,Bing,"Reliance, Disney win approval for $8.5 billion India media assets merger",https://www.indiatoday.in/business/story/disney-reliance-win-competition-commission-of-india-approval-india-media-assets-merger-2589459-2024-08-28,2024-08-28T17:15:20+05:30,India Today
Reliance,Merger,Reliance Merger,Bing,Reliance-Disney Merger Approved; Nita Ambani to Chair New Entity: What’s The Net Worth Of Mukesh Ambani's Wife,https://www.msn.com/en-in/news/world/reliance-disney-merger-approved-nita-ambani-to-chair-new-entity-what-s-the-net-worth-of-mukesh-ambanis-wife/ar-AA1pA7sn?ocid=BingNewsVerp,,Times Now on MSN
Reliance,Merger,Reliance Merger,Bing,Content creators worry over limited options with likely JioCinema-Hotstar merger,https://www.livemint.com/industry/media/content-creators-jiocinema-disney-hotstar-reliance-ott-11725346956470.html,2024-09-03T14:04:15+05:30,Mint
